{
  "$schema": "https://json-schema.org/draft/2020-12/schema",
  "$id": "https://spawnr-cli.dev/schemas/runtime-manifest-v1.json",
  "title": "Spawnr runtime manifest v1",
  "type": "object",
  "additionalProperties": false,
  "required": [
    "schema_version",
    "runtime_version",
    "target",
    "protocol_version",
    "cli_compatibility",
    "components",
    "files"
  ],
  "properties": {
    "schema_version": { "const": 1 },
    "runtime_version": { "$ref": "#/$defs/semver" },
    "target": { "const": "x86_64-linux" },
    "protocol_version": { "const": 1 },
    "cli_compatibility": { "$ref": "#/$defs/cliCompatibility" },
    "components": {
      "type": "array",
      "minItems": 14,
      "uniqueItems": true,
      "items": { "$ref": "#/$defs/component" }
    },
    "files": {
      "type": "array",
      "minItems": 1,
      "uniqueItems": true,
      "items": { "$ref": "#/$defs/file" }
    }
  },
  "$defs": {
    "semver": {
      "type": "string",
      "pattern": "^[0-9]+\\.[0-9]+\\.[0-9]+(?:-[0-9A-Za-z.-]+)?$"
    },
    "sha256": {
      "type": "string",
      "pattern": "^[0-9a-f]{64}$",
      "not": { "const": "0000000000000000000000000000000000000000000000000000000000000000" }
    },
    "runtimePath": {
      "type": "string",
      "pattern": "^(?:bin|guest|lib|share)/[^/]+(?:/[^/]+)*$"
    },
    "runtimeDirectory": {
      "type": "string",
      "pattern": "^(?:bin|guest|lib|share)(?:/[^/]+)*$"
    },
    "libraryDirectory": {
      "type": "string",
      "pattern": "^lib(?:/[^/]+)*$"
    },
    "loaderPath": {
      "type": "string",
      "pattern": "^lib/[^/]+(?:/[^/]+)*$"
    },
    "cliCompatibility": {
      "type": "object",
      "additionalProperties": false,
      "required": ["minimum", "maximum_exclusive"],
      "properties": {
        "minimum": { "$ref": "#/$defs/semver" },
        "maximum_exclusive": { "$ref": "#/$defs/semver" }
      }
    },
    "component": {
      "type": "object",
      "additionalProperties": false,
      "required": ["name", "version", "kind", "path"],
      "properties": {
        "name": {
          "type": "string",
          "pattern": "^[a-z0-9](?:[a-z0-9-]*[a-z0-9])?$"
        },
        "version": { "type": "string", "minLength": 1 },
        "kind": {
          "enum": [
            "host_executable",
            "guest_kernel",
            "guest_initramfs",
            "guest_executable",
            "data"
          ]
        },
        "path": { "$ref": "#/$defs/runtimePath" },
        "launcher": { "$ref": "#/$defs/launcher" }
      },
      "allOf": [
        {
          "if": {
            "properties": { "kind": { "const": "host_executable" } },
            "required": ["kind"]
          },
          "then": { "required": ["launcher"] },
          "else": { "not": { "required": ["launcher"] } }
        }
      ]
    },
    "launcher": {
      "oneOf": [
        {
          "type": "object",
          "additionalProperties": false,
          "required": ["kind"],
          "properties": { "kind": { "const": "direct" } }
        },
        {
          "type": "object",
          "additionalProperties": false,
          "required": ["kind", "loader", "library_paths"],
          "properties": {
            "kind": { "const": "elf_loader" },
            "loader": { "$ref": "#/$defs/loaderPath" },
            "library_paths": {
              "type": "array",
              "minItems": 1,
              "uniqueItems": true,
              "items": { "$ref": "#/$defs/libraryDirectory" }
            }
          }
        }
      ]
    },
    "file": {
      "type": "object",
      "additionalProperties": false,
      "required": ["path", "size_bytes", "sha256", "executable"],
      "properties": {
        "path": { "$ref": "#/$defs/runtimePath" },
        "size_bytes": { "type": "integer", "minimum": 1 },
        "sha256": { "$ref": "#/$defs/sha256" },
        "executable": { "type": "boolean" }
      }
    }
  }
}
